{
  "name": "Крупа пшенная",
  "name_normalized": "krupa_pshennaya",
  "synonyms": "крупа пшенная, пшено, пшено шлифованное, пшенка, пшенная крупа, пшено дранец, дробленое пшено, просо, крупа из проса, millet, millet groats, Panicum miliaceum",
  "short_description": "Крупа, получаемая из зерен проса путем удаления цветочных пленок и шлифования. Имеет ярко-желтый цвет, круглые гладкие зерна и нейтральный вкус с легкой сладостью. Богата белком, витаминами группы B, фосфором, калием и магнием. Не содержит глютен.",
  "description": "<h2 class=\"ingredient-title\">Краткая характеристика</h2><p class=\"ingredient-text\">Пшенная крупа (пшено) — это крупа, получаемая из зерен проса (Panicum miliaceum) путем удаления цветочных пленок и шлифования. Вопреки распространенному заблуждению, пшено не имеет отношения к пшенице, несмотря на созвучное название. Просо — одна из древнейших сельскохозяйственных культур, известная человечеству более 5000 лет. Пшено шлифованное делится на три сорта: высший, первый и второй, в зависимости от количества примесей и качества очистки. Цвет крупы варьируется от светло-желтого до ярко-желтого; чем ярче цвет, тем лучше считается крупа.</p><p class=\"ingredient-text\">Пшено — одна из самых полезных круп, содержащая больше белка, чем рис и ячмень; больше фосфора, чем мясо; больше фолиевой кислоты, чем пшеница и кукуруза; больше витаминов группы B, чем остальные злаковые культуры. Пшено не содержит глютен, поэтому подходит людям с целиакией и аллергией на пшеничный белок.</p><h2 class=\"ingredient-title\">Свойства и особенности</h2><ul class=\"ingredient-list ingredient-list-bulleted\"><li class=\"ingredient-list-item\"><strong>Текстура</strong> — круглая, гладкая, твердая (до варки), мягкая (после варки)</li><li class=\"ingredient-list-item\"><strong>Вкус</strong> — нейтральный, слегка сладковатый</li><li class=\"ingredient-list-item\"><strong>Цвет</strong> — от светло-желтого до ярко-желтого</li><li class=\"ingredient-list-item\"><strong>Форма</strong> — мелкие гладкие зерна (шлифованные)</li><li class=\"ingredient-list-item\"><strong>Срок хранения</strong> — 7-9 месяцев (при более длительном хранении начинает горчить)</li><li class=\"ingredient-list-item\"><strong>Особенность</strong> — не содержит глютен; перед варкой рекомендуется промыть и обжарить для рассыпчатости</li></ul><h2 class=\"ingredient-title\">Виды пшенной крупы</h2><ul class=\"ingredient-list ingredient-list-bulleted\"><li class=\"ingredient-list-item\"><strong>Пшено шлифованное</strong> — гладкие круглые зерна без оболочек и зародыша, наиболее распространенный вид</li><li class=\"ingredient-list-item\"><strong>Дробленое пшено</strong> — побочный продукт обдирки, для жидких каш</li><li class=\"ingredient-list-item\"><strong>Пшено-дранец</strong> — счищены только цветочные пленки, сохраняется зародыш, встречается редко</li><li class=\"ingredient-list-item\"><strong>Пшенные хлопья</strong> — расплющенные зерна, время приготовления 1 минута</li><li class=\"ingredient-list-item\"><strong>Экструдированные гранулы</strong> — пористые гранулы одинакового размера, длительный срок хранения</li></ul><h2 class=\"ingredient-title\">Подготовка</h2><ul class=\"ingredient-list ingredient-list-bulleted\"><li class=\"ingredient-list-item\"><strong>Промывка</strong> — тщательно промыть холодной водой до прозрачности</li><li class=\"ingredient-list-item\"><strong>Обжаривание</strong> — на сухой сковороде 2-3 минуты для рассыпчатости и аромата</li><li class=\"ingredient-list-item\"><strong>Варка</strong> — в соотношении 1:2,5 или 1:3 (крупа:жидкость), варить 25-30 минут</li><li class=\"ingredient-list-item\"><strong>Замачивание</strong> — не требуется</li></ul><h2 class=\"ingredient-title\">Кулинарное применение</h2><ul class=\"ingredient-list ingredient-list-bulleted\"><li class=\"ingredient-list-item\"><strong>Каши</strong> — молочные и водные, с тыквой, мясом, овощами</li><li class=\"ingredient-list-item\"><strong>Супы</strong> — пшенный суп, кулеш</li><li class=\"ingredient-list-item\"><strong>Гарниры</strong> — к мясу, рыбе, птице</li><li class=\"ingredient-list-item\"><strong>Запеканки</strong> — с творогом, тыквой, мясом</li><li class=\"ingredient-list-item\"><strong>Крупеники</strong> — традиционное блюдо</li><li class=\"ingredient-list-item\"><strong>Пудинги</strong> — молочные и фруктовые</li></ul><h2 class=\"ingredient-title\">С чем сочетается</h2><ul class=\"ingredient-list ingredient-list-bulleted\"><li class=\"ingredient-list-item\"><strong>Мясо</strong> — свинина, говядина, курица, баранина</li><li class=\"ingredient-list-item\"><strong>Овощи</strong> — тыква, лук, морковь, картофель, капуста</li><li class=\"ingredient-list-item\"><strong>Молочные продукты</strong> — молоко, сливки, масло, творог</li><li class=\"ingredient-list-item\"><strong>Фрукты и ягоды</strong> — яблоки, изюм, курага, ягоды</li><li class=\"ingredient-list-item\"><strong>Грибы</strong> — в супах и запеканках</li><li class=\"ingredient-list-item\"><strong>Специи</strong> — черный перец, лавровый лист, тмин</li></ul><h2 class=\"ingredient-title\">Чем заменить</h2><ul class=\"ingredient-list ingredient-list-bulleted\"><li class=\"ingredient-list-item\"><strong>Рис</strong> — для гарниров и супов</li><li class=\"ingredient-list-item\"><strong>Булгур</strong> — для гарниров и салатов</li><li class=\"ingredient-list-item\"><strong>Кукурузная крупа</strong> — для каш и запеканок</li><li class=\"ingredient-list-item\"><strong>Киноа</strong> — безглютеновая альтернатива</li></ul>",

  "category": "Крупы и злаки",

  "data_source": "skurikhin_tutelyan_2002",

  "calories": 342,
  "protein": 11.5,
  "fat": 3.3,
  "carbohydrates": 66.5,

  "water": 14.0,
  "ash": 1.7,
  "fiber": 3.6,

  "vitamin_b1": 0.42,
  "vitamin_b2": 0.04,
  "vitamin_b3": 1.6,
  "vitamin_e": 0.3,

  "potassium": 211,
  "calcium": 27,
  "magnesium": 83,
  "sodium": 10,
  "phosphorus": 233,

  "iron": 2.7,

  "semantic_data": {
    "properties": [
      "крупа",
      "просо",
      "пшено",
      "желтый",
      "нейтральный вкус",
      "без глютена",
      "высокобелковая",
      "для каш",
      "для супов",
      "для гарниров",
      "для запеканок"
    ],
    "preparations": [
      "промывка холодной водой до прозрачности",
      "обжаривание на сухой сковороде 2-3 минуты",
      "варка в соотношении 1:2,5 или 1:3"
    ],
    "cooking_methods": [
      {"method": "варка каши", "priority": "high"},
      {"method": "добавление в супы", "priority": "high"},
      {"method": "приготовление гарниров", "priority": "high"},
      {"method": "приготовление запеканок", "priority": "high"},
      {"method": "приготовление крупеников", "priority": "medium"},
      {"method": "приготовление пудингов", "priority": "medium"}
    ],
    "applications": [
      "каши",
      "супы",
      "гарниры",
      "запеканки",
      "крупеники",
      "пудинги"
    ],
    "pairings": {
      "protein": ["свинина", "говядина", "курица", "баранина"],
      "vegetables": ["тыква", "лук", "морковь", "картофель", "капуста"],
      "sauces": ["молочный", "сливочный", "томатный"],
      "herbs": ["петрушка", "укроп"],
      "spices": ["черный перец", "лавровый лист", "тмин"]
    },
    "substitutes": [
      {"name": "Рис", "similarity": "medium"},
      {"name": "Булгур", "similarity": "medium"},
      {"name": "Кукурузная крупа", "similarity": "medium"},
      {"name": "Киноа", "similarity": "low"}
    ]
  },

  "tags": [
    "крупа",
    "пшенная крупа",
    "пшено",
    "пшенка",
    "просо",
    "без глютена",
    "каши",
    "супы",
    "гарниры",
    "запеканки"
  ]
}