{
  "name": "Купаты из индейки",
  "name_normalized": "kupaty_iz_indeiki",
  "synonyms": "купаты из индейки, купаты индейка, колбаски из индейки, купаты домашние из индейки, купаты для жарки, купаты для гриля, купаты в духовке, купаты на сковороде, индейка в оболочке",
  "short_description": "Колбасное изделие из рубленого мяса индейки с добавлением лука и специй, в натуральной или коллагеновой оболочке. Отличается сочностью, нежным вкусом и диетическими свойствами. Подходит для жарки, запекания и гриля.",
  "description": "<h2 class=\"ingredient-title\">Краткая характеристика</h2><p class=\"ingredient-text\">Купаты из индейки — это колбасные изделия из рубленого мяса индейки с добавлением лука, соли, перца и других специй, в натуральной свиной или бараньей череве либо в коллагеновой оболочке. В отличие от традиционных купат из свинины, вариант из индейки получается более постным и диетическим, но при этом сохраняет сочность и насыщенный вкус благодаря добавлению лука и правильному подбору частей птицы.</p><p class=\"ingredient-text\">Для приготовления купат используют фарш из филе бедра и грудки индейки, иногда с добавлением сливок для сочности. Готовые купаты можно жарить на сковороде, запекать в духовке или готовить на гриле. Это универсальное блюдо для повседневного и праздничного стола, которое хорошо сочетается с овощами, картофелем и свежей зеленью.</p><h2 class=\"ingredient-title\">Свойства и особенности</h2><ul class=\"ingredient-list ingredient-list-bulleted\"><li class=\"ingredient-list-item\"><strong>Текстура</strong> — плотная, сочная, упругая</li><li class=\"ingredient-list-item\"><strong>Вкус</strong> — нежный, индюшиный, с ароматом специй и лука</li><li class=\"ingredient-list-item\"><strong>Цвет</strong> — от бледно-розового до светло-коричневого (после обжарки)</li><li class=\"ingredient-list-item\"><strong>Форма</strong> — небольшие колбаски в оболочке</li><li class=\"ingredient-list-item\"><strong>Срок хранения</strong> — охлаждённые до 5-7 суток, замороженные до 3 месяцев</li><li class=\"ingredient-list-item\"><strong>Особенность</strong> — диетический продукт с высоким содержанием белка</li></ul><h2 class=\"ingredient-title\">Состав (типичный)</h2><ul class=\"ingredient-list ingredient-list-bulleted\"><li class=\"ingredient-list-item\"><strong>Основное сырьё</strong> — мясо индейки (филе бедра, грудки)</li><li class=\"ingredient-list-item\"><strong>Дополнительно</strong> — лук репчатый, вода питьевая</li><li class=\"ingredient-list-item\"><strong>Посолочные</strong> — соль, смесь специй (чеснок, перец красный, кориандр, кинза)</li><li class=\"ingredient-list-item\"><strong>Оболочка</strong> — свиная черева или коллагеновая оболочка</li></ul><h2 class=\"ingredient-title\">Подготовка</h2><ul class=\"ingredient-list ingredient-list-bulleted\"><li class=\"ingredient-list-item\"><strong>Хранение</strong> — в холодильнике при 0–6°C</li><li class=\"ingredient-list-item\"><strong>Прокол</strong> — перед жаркой слегка проколоть оболочку зубочисткой, чтобы купаты не лопнули</li><li class=\"ingredient-list-item\"><strong>Жарка на сковороде</strong> — на среднем огне обжарить со всех сторон по 3–5 минут до румяной корочки, затем убавить огонь, накрыть крышкой и готовить ещё 10–15 минут</li><li class=\"ingredient-list-item\"><strong>Запекание в духовке</strong> — при 170–180°C, накрыв фольгой на первые 15–20 минут, затем снять фольгу и запекать ещё 5–7 минут для корочки; общее время 20–25 минут</li><li class=\"ingredient-list-item\"><strong>Гриль</strong> — на среднем жару 10–15 минут, переворачивая каждые 3–4 минуты</li></ul><h2 class=\"ingredient-title\">Кулинарное применение</h2><ul class=\"ingredient-list ingredient-list-bulleted\"><li class=\"ingredient-list-item\"><strong>Самостоятельное блюдо</strong> — жареные или запечённые купаты</li><li class=\"ingredient-list-item\"><strong>Гарниры</strong> — картофель, овощи, рис, гречка</li><li class=\"ingredient-list-item\"><strong>Гриль</strong> — на шпажках с овощами</li><li class=\"ingredient-list-item\"><strong>Закуски</strong> — нарезка для праздничного стола</li></ul><h2 class=\"ingredient-title\">С чем сочетается</h2><ul class=\"ingredient-list ingredient-list-bulleted\"><li class=\"ingredient-list-item\"><strong>Овощи</strong> — перец, лук, шампиньоны, кабачки, помидоры</li><li class=\"ingredient-list-item\"><strong>Соусы</strong> — томатный, сметанный, горчичный, барбекю</li><li class=\"ingredient-list-item\"><strong>Зелень</strong> — петрушка, укроп, кинза</li><li class=\"ingredient-list-item\"><strong>Специи</strong> — орегано, паприка, чеснок, чёрный перец</li><li class=\"ingredient-list-item\"><strong>Гарниры</strong> — картофельное пюре, овощи гриль, рис</li></ul><h2 class=\"ingredient-title\">Чем заменить</h2><ul class=\"ingredient-list ingredient-list-bulleted\"><li class=\"ingredient-list-item\"><strong>Купаты из курицы</strong> — менее питательные, но схожие</li><li class=\"ingredient-list-item\"><strong>Купаты из свинины</strong> — более жирные</li><li class=\"ingredient-list-item\"><strong>Колбаски для гриля</strong> — более крупные</li><li class=\"ingredient-list-item\"><strong>Домашние колбаски из фарша индейки</strong> — по своему рецепту</li></ul>",
  "category": "Мясо и мясные продукты",
  "data_source": "health-diet.ru",
  "calories": 220,
  "protein": 11.0,
  "fat": 20.0,
  "carbohydrates": 0.0,
  "vitamin_a": 8,
  "vitamin_b1": 0.02,
  "vitamin_b2": 0.17,
  "vitamin_b3": 5.9,
  "vitamin_e": 0.3,
  "vitamin_b3": 12.6,
  "potassium": 179,
  "calcium": 19,
  "magnesium": 19,
  "sodium": 275,
  "phosphorus": 183,
  "iron": 1.3,
  "cholesterol": 189,
  "saturated_fat": 5.2,
  "semantic_data": {
    "properties": [
      "колбасное изделие",
      "индейка",
      "диетические",
      "высокобелковые",
      "для жарки",
      "для запекания",
      "для гриля",
      "в оболочке"
    ],
    "preparations": [
      "хранение в холодильнике",
      "прокол оболочки перед жаркой",
      "жарка на сковороде",
      "запекание в духовке с фольгой",
      "гриль на решётке"
    ],
    "cooking_methods": [
      {"method": "жарка на сковороде", "priority": "high"},
      {"method": "запекание в духовке", "priority": "high"},
      {"method": "гриль", "priority": "high"},
      {"method": "отваривание", "priority": "medium"}
    ],
    "applications": [
      "вторые блюда",
      "закуски",
      "гриль",
      "праздничный стол"
    ],
    "pairings": {
      "protein": [],
      "vegetables": ["перец", "лук", "шампиньоны", "кабачки", "помидоры"],
      "sauces": ["томатный", "сметанный", "горчичный", "барбекю"],
      "herbs": ["петрушка", "укроп", "кинза"],
      "spices": ["орегано", "паприка", "чеснок", "чёрный перец"]
    },
    "substitutes": [
      {"name": "Купаты из курицы", "similarity": "high"},
      {"name": "Купаты из свинины", "similarity": "medium"},
      {"name": "Колбаски для гриля", "similarity": "medium"},
      {"name": "Домашние колбаски из фарша индейки", "similarity": "high"}
    ]
  },
  "tags": [
    "мясо",
    "индейка",
    "купаты",
    "колбасное изделие",
    "диетические",
    "для жарки",
    "для гриля",
    "для запекания"
  ]
}