{
  "name": "Семга слабосоленая",
  "name_normalized": "semga_slabosolenaya",
  "synonyms": "семга слабосоленая, слабосоленая семга, малосольная семга, семга малосольная, лосось слабосоленый, слабосоленый лосось, семга соленая, семга слабой соли, семга для бутербродов, семга для салатов",
  "short_description": "Филе атлантического лосося (семги), приготовленное методом слабого посола с добавлением соли, сахара и специй. Имеет нежную, сочную текстуру и насыщенный вкус. Готовый к употреблению деликатес, богатый омега-3, белком и витамином D.",
  "description": "<h2 class=\"ingredient-title\">Краткая характеристика</h2><p class=\"ingredient-text\">Семга слабосоленая — это филе атлантического лосося, приготовленное методом слабого посола. В процессе засолки рыба сохраняет свою нежную текстуру и естественный вкус, приобретая лишь легкую соленость. Для приготовления используется смесь соли и сахара (часто в пропорции 2:1 или 1:1), а также специи — черный перец, укроп, кориандр, лавровый лист. Слабосоленая семга — это готовый к употреблению деликатес, который подают как самостоятельную закуску, добавляют в бутерброды, салаты и сэндвичи.</p><p class=\"ingredient-text\">В отличие от сильного посола, слабый посол позволяет сохранить максимум полезных свойств рыбы. Семга слабосоленая богата омега-3 жирными кислотами, полноценным белком, витаминами D, B12, B6, а также минералами — селеном, фосфором, калием. Благодаря высокому содержанию жира, мясо остается сочным и нежным. Слабосоленая семга считается диетическим продуктом, но из-за высокого содержания соли ее употребление рекомендуется умеренным.</p><h2 class=\"ingredient-title\">Свойства и особенности</h2><ul class=\"ingredient-list ingredient-list-bulleted\"><li class=\"ingredient-list-item\"><strong>Текстура</strong> — нежная, сочная, упругая</li><li class=\"ingredient-list-item\"><strong>Вкус</strong> — насыщенный, сливочный, с умеренной соленостью</li><li class=\"ingredient-list-item\"><strong>Цвет</strong> — розово-оранжевый</li><li class=\"ingredient-list-item\"><strong>Форма</strong> — ломтики, филе-кусок, нарезка</li><li class=\"ingredient-list-item\"><strong>Срок хранения</strong> — в холодильнике до 3–5 суток (в вакуумной упаковке — до 30 суток)</li><li class=\"ingredient-list-item\"><strong>Особенность</strong> — готовый к употреблению продукт, не требует термической обработки</li></ul><h2 class=\"ingredient-title\">Состав (типичный)</h2><ul class=\"ingredient-list ingredient-list-bulleted\"><li class=\"ingredient-list-item\"><strong>Основное сырьё</strong> — филе семги (атлантического лосося)</li><li class=\"ingredient-list-item\"><strong>Посолочные</strong> — соль, сахар</li><li class=\"ingredient-list-item\"><strong>Специи</strong> — черный перец, укроп, кориандр, лавровый лист (в зависимости от рецепта)</li><li class=\"ingredient-list-item\"><strong>Добавки</strong> — иногда консерванты (бензоат натрия, сорбат калия)</li></ul><h2 class=\"ingredient-title\">Подготовка</h2><ul class=\"ingredient-list ingredient-list-bulleted\"><li class=\"ingredient-list-item\"><strong>Хранение</strong> — в холодильнике при 0–4°C</li><li class=\"ingredient-list-item\"><strong>Нарезка</strong> — тонкими ломтиками перед подачей</li><li class=\"ingredient-list-item\"><strong>Подача</strong> — как самостоятельная закуска, с хлебом, маслом, лимоном</li><li class=\"ingredient-list-item\"><strong>Использование в блюдах</strong> — без дополнительной термической обработки</li></ul><h2 class=\"ingredient-title\">Кулинарное применение</h2><ul class=\"ingredient-list ingredient-list-bulleted\"><li class=\"ingredient-list-item\"><strong>Закуска</strong> — нарезка на бутерброды, канапе, тарталетки</li><li class=\"ingredient-list-item\"><strong>Салаты</strong> — с зеленью, авокадо, огурцами, яйцами</li><li class=\"ingredient-list-item\"><strong>Сэндвичи</strong> — с маслом, сыром, овощами</li><li class=\"ingredient-list-item\"><strong>Суши и роллы</strong> — как начинка</li><li class=\"ingredient-list-item\"><strong>Паста</strong> — с сливочным соусом</li><li class=\"ingredient-list-item\"><strong>Блинчики</strong> — с семгой и сливочным сыром</li></ul><h2 class=\"ingredient-title\">С чем сочетается</h2><ul class=\"ingredient-list ingredient-list-bulleted\"><li class=\"ingredient-list-item\"><strong>Хлеб</strong> — багет, ржаной, тостовый, бородинский</li><li class=\"ingredient-list-item\"><strong>Сыры</strong> — сливочный, творожный, рикотта, маскарпоне</li><li class=\"ingredient-list-item\"><strong>Овощи</strong> — огурцы, помидоры, авокадо, листья салата</li><li class=\"ingredient-list-item\"><strong>Яйца</strong> — вареные, в салатах</li><li class=\"ingredient-list-item\"><strong>Цитрусовые</strong> — лимон, лайм</li><li class=\"ingredient-list-item\"><strong>Травы</strong> — укроп, петрушка, зеленый лук</li><li class=\"ingredient-list-item\"><strong>Напитки</strong> — белое вино, шампанское</li></ul><h2 class=\"ingredient-title\">Чем заменить</h2><ul class=\"ingredient-list ingredient-list-bulleted\"><li class=\"ingredient-list-item\"><strong>Семга холодного копчения</strong> — схожий продукт, но с дымным ароматом</li><li class=\"ingredient-list-item\"><strong>Форель слабосоленая</strong> — менее жирная</li><li class=\"ingredient-list-item\"><strong>Кета слабосоленая</strong> — более плотное мясо</li><li class=\"ingredient-list-item\"><strong>Горбуша слабосоленая</strong> — менее жирная</li></ul>",
  "category": "Рыба и морепродукты",
  "data_source": "health-diet.ru",
  "calories": 225,
  "protein": 21.5,
  "fat": 5.5,
  "carbohydrates": 0,
  "water": 70.6,
  "sodium": 5910.3,
  "potassium": 479.3,
  "calcium": 29.3,
  "magnesium": 37.8,
  "iron": 0.6,
  "vitamin_a": 43.9,
  "vitamin_c": 6.6,
  "vitamin_d": 13.6,
  "vitamin_e": 0.5,
  "vitamin_b9_folate": 6.4,
  "cholesterol": 57.5,
  "saturated_fat": 1.0,
  "semantic_data": {
    "properties": [
      "рыба",
      "красная рыба",
      "лососевые",
      "слабосоленая",
      "готовая к употреблению",
      "деликатес",
      "источник омега-3",
      "источник витамина D",
      "источник белка",
      "для закусок",
      "для бутербродов",
      "для салатов"
    ],
    "preparations": [
      "хранение в холодильнике",
      "нарезка тонкими ломтиками",
      "подача без термической обработки"
    ],
    "cooking_methods": [
      {"method": "подача в нарезке (закуска)", "priority": "high"},
      {"method": "использование в бутербродах", "priority": "high"},
      {"method": "добавление в салаты", "priority": "high"},
      {"method": "использование в суши и роллах", "priority": "medium"},
      {"method": "добавление в пасту", "priority": "medium"}
    ],
    "applications": [
      "закуски",
      "бутерброды",
      "салаты",
      "суши и роллы",
      "паста",
      "блинчики"
    ],
    "pairings": {
      "protein": ["сливочный сыр", "творожный сыр", "рикотта", "маскарпоне", "яйца"],
      "vegetables": ["огурцы", "помидоры", "авокадо", "листья салата"],
      "sauces": ["сливочный соус", "лимонный соус"],
      "herbs": ["укроп", "петрушка", "зеленый лук"],
      "spices": ["черный перец", "лимон"]
    },
    "substitutes": [
      {"name": "Семга холодного копчения", "similarity": "high"},
      {"name": "Форель слабосоленая", "similarity": "high"},
      {"name": "Кета слабосоленая", "similarity": "medium"},
      {"name": "Горбуша слабосоленая", "similarity": "medium"}
    ]
  },
  "tags": [
    "рыба",
    "семга",
    "лосось",
    "слабосоленая",
    "закуска",
    "бутерброды",
    "салаты",
    "омега-3",
    "витамин D"
  ]
}